,course_id,course_title,url,level,content_duration,subject
1690,753934,Create Flat Designs with Inkscape ,https://www.udemy.com/create-flat-designs-with-inkscape/,Beginner Level,1.5,Graphic Design
1691,206592,:::Beginners Guide To Creating Amazing Images with Canva:::,https://www.udemy.com/beginners-guide-to-creating-amazing-images-with-canva/,Beginner Level,1.0,Graphic Design
1692,15467,Learn To Draw - The COMIC BOOK STYLE,https://www.udemy.com/learn-to-draw/,All Levels,2.0,Graphic Design
1693,983444,Adobe Illustrator Vectors For Hand Letterers,https://www.udemy.com/adobe-illustrator-vectors-for-hand-letterers/,Beginner Level,0.6166666666666667,Graphic Design
1694,74782,How To Create Amazing YouTube Custom Thumbnail Images,https://www.udemy.com/how-to-create-amazing-youtube-custom-thumbnail-images/,All Levels,1.5,Graphic Design
1695,456988,Graphic Design Bootcamp: Professional Workflow & Layout Tips,https://www.udemy.com/graphic-design-bootcamp-layout-and-workflow-basics/,All Levels,1.5,Graphic Design
1696,1049760,Promotional Design Master Class,https://www.udemy.com/promotional-design-master-class/,All Levels,2.0,Graphic Design
1697,808808,Introduction to GIMP 2.8: Tutorials for Beginners,https://www.udemy.com/introduction-to-gimp-for-beginners/,Beginner Level,3.0,Graphic Design
1698,599652,48 Logo Designs and Techniques,https://www.udemy.com/professional-logo-design-vol-2/,All Levels,9.0,Graphic Design
1699,524748,Photoshop JumpStart,https://www.udemy.com/photoshop-jumpstart/,Beginner Level,2.0,Graphic Design
1700,310652,How To Sell Practically Anything: Professional Design Mockup,https://www.udemy.com/how-to-sell-practically-anything-professional-design-mockup/,All Levels,2.5,Graphic Design
1701,946326,"Learn Calligraphy, Handwriting animation wz After Effects",https://www.udemy.com/animate_calligraphy_art/,All Levels,2.5,Graphic Design
1702,1146166,LaTeX A-Z: from beginner to advance in less than 3 hour,https://www.udemy.com/become-a-good-latex-user-to-create-professional-documents/,Beginner Level,3.0,Graphic Design
1703,1190334,Course Bundle | Exploring Art : Silhouette & Linear Line Art,https://www.udemy.com/course-bundle-exploring-art-silhouette-linear-line-art/,All Levels,1.0,Graphic Design
1704,895394,How To Build Your Own Web Banner Design Business,https://www.udemy.com/how-to-build-your-own-web-banner-design-business/,All Levels,1.0,Graphic Design
1705,1100628,Canva: Design and Sell Your Own Professional Canva Designs,https://www.udemy.com/canva-design-and-sell-your-own-professional-graphic-designs/,All Levels,3.0,Graphic Design
1706,996868,How to Design a Logo in Adobe Illustrator,https://www.udemy.com/logoworkshop/,All Levels,1.0,Graphic Design
1707,751230,Illustrator CC: Design and drawing from scratch to expert!,https://www.udemy.com/illustrator-cc-design-and-drawing-from-scratch-to-expert/,Beginner Level,11.0,Graphic Design
1708,356840,Logo design: How To Design an Awesome Logo in Illustrator,https://www.udemy.com/designing-logos-learning-illustrator/,All Levels,5.5,Graphic Design
1709,269082,Photoshop: Real World Hands-on Freelance Mastery,https://www.udemy.com/photoshop-real-world-hands-on-graphic-and-web-design/,All Levels,2.5,Graphic Design
1710,449788,Graphic Design: Beginner's Graphic Design Guide to Photoshop,https://www.udemy.com/how-to-use-adobe-photoshop-for-beginners/,All Levels,1.0,Graphic Design
1711,792232,Most Wanted Flat Design Techniques,https://www.udemy.com/flat-design-flat-ui-design-flat-colors-flat-design-illustrator/,Intermediate Level,4.5,Graphic Design
1712,1164876,3DS MAX - Learn 3Ds MAX tutorial for Beginners in Urdu Hindi,https://www.udemy.com/learn-3ds-max-tutorial-for-beginners-in-urdu-hindi/,All Levels,4.5,Graphic Design
1713,861444,Design your own Social Media Logo Icons in Adobe Illustrator,https://www.udemy.com/design-social-media-logo-icons-in-adobe-illustrator/,Beginner Level,1.5,Graphic Design
1714,148982,Mashup - Transform a scanned sketch into a digital painting,https://www.udemy.com/mashup-transform-a-scanned-sketch-into-a-digital-painting/,Intermediate Level,2.0,Graphic Design
1715,861742,Motion Graphic With After Effect From Scratch in 5 Hours,https://www.udemy.com/motion-graphic-with-ae/,All Levels,4.0,Graphic Design
1716,817074,Introduction to Photoshop CC: Tutorials for Beginners,https://www.udemy.com/introduction-to-photoshop-cc-tutorials-for-beginners/,Beginner Level,1.0,Graphic Design
1717,286160,Making Killer Images in Photoshop that WOW Clients!,https://www.udemy.com/killer-photoshop-images/,Intermediate Level,5.0,Graphic Design
1718,788722,Simple Photoshop CC: Smart Objects,https://www.udemy.com/simple-photoshop-cc-smart-objects/,Intermediate Level,0.5,Graphic Design
1719,1008654,Learn Photo Manipulation - Build 3 projects,https://www.udemy.com/learn-photo-manipulation-build-3-projects/,All Levels,2.5,Graphic Design
1720,964478,Zombie Apocalypse Photoshop Actions,https://www.udemy.com/zombie-apocalypse-photoshop-actions/,All Levels,1.5,Graphic Design
1721,953220,Creative Perspective Illustration with GIMP,https://www.udemy.com/creative-perspective/,All Levels,6.5,Graphic Design
1722,64078,iPhone icons in iOS7 - learn flat design,https://www.udemy.com/iphone-icon-secrets-flat-design/,All Levels,3.0,Graphic Design
1723,1046540,How to draw professional manga artwork by Punix,https://www.udemy.com/punix_drawface/,Beginner Level,1.5,Graphic Design
1724,622284,How do I Create a Stylized Graphics from Images in Photoshop,https://www.udemy.com/how-do-i-create-a-stylized-graphics-from-images-in-photoshop/,All Levels,1.0,Graphic Design
1725,31150,Advance Design of Logos and Brand Identity   ,https://www.udemy.com/advance-design-of-logos-and-brand-identity/,All Levels,2.0,Graphic Design
1726,574132,Como utilizar o Corel Draw por completo!,https://www.udemy.com/como-utilizar-o-corel-draw-por-completo/,All Levels,7.0,Graphic Design
1727,724824,Photoshop　中級者、上級者がプロになるために最後に学ぶ「超絶技巧」テクニック,https://www.udemy.com/photoshop-s/,Intermediate Level,4.5,Graphic Design
1728,883324,Corel Draw X7: Mão na Massa,https://www.udemy.com/corel-draw-x7-mao-na-massa/,Beginner Level,4.0,Graphic Design
1729,502204,Dibujo digital básico: cómo ilustrar en Photoshop,https://www.udemy.com/dibujo-digital-basico-como-ilustrar-en-photoshop/,Beginner Level,5.0,Graphic Design
1730,283038,Adobe Illustrator CS6 باللغة العربية,https://www.udemy.com/adobe-illustrator-cs6-kottab/,All Levels,8.0,Graphic Design
1731,650720,Creare un logo con Adobe Illustrator,https://www.udemy.com/crea-il-tuo-logo-con-adobe-illustrator/,All Levels,1.0,Graphic Design
1732,586680,Mestres do Photoshop,https://www.udemy.com/mestres-do-photoshop/,All Levels,5.5,Graphic Design
1733,899240,illustrator CC 2015.3 - Curso básico de ferramentas,https://www.udemy.com/illustratorcc20153/,Beginner Level,1.0,Graphic Design
1734,520876,Plantillas Powerpoint para Publicar en Mercadolibre y Ebay,https://www.udemy.com/publicacion-rapida-y-profesional-en-mercadolibre/,All Levels,2.0,Graphic Design
1735,1083784,Crie seu Cartão de Visita no CorelDRAW X8,https://www.udemy.com/crie-seu-cartao-de-visita-no-coreldraw-x8/,Beginner Level,4.0,Graphic Design
1736,651352,Curso de Maya 3D,https://www.udemy.com/curso-de-maya-3d/,All Levels,4.0,Graphic Design
1737,968268,Photoshop: Organización de eventos y decoración de fiestas,https://www.udemy.com/curso-de-photoshop-como-hacer-todo-para-tu-fiesta-tematica/,Beginner Level,8.5,Graphic Design
1738,479760,Podcast Cover Art | Design Like the Best,https://www.udemy.com/podcast-graphic-design/,All Levels,1.0,Graphic Design
1739,134690,Learn Drawing and Painting a Landscape with Oil Colours,https://www.udemy.com/learn-drawing-and-painting-a-landscape-with-oil-colours/,Intermediate Level,2.0,Graphic Design
1740,692918,Enhance your chroma key with an animated Slides background,https://www.udemy.com/enhance-your-chroma-key-with-an-animated-slides-background/,Intermediate Level,1.0,Graphic Design
1741,1092632,The Complete Motion Graphic Course,https://www.udemy.com/complete-motion-graphic-course/,All Levels,9.5,Graphic Design
1742,753154,Making Corporate Flyers in Photoshop,https://www.udemy.com/making-corporate-flyers-in-photoshop/,All Levels,0.5166666666666666,Graphic Design
1743,46524,Rock-Solid Brands,https://www.udemy.com/rock-solid-brands/,Beginner Level,0.5166666666666666,Graphic Design
1744,634480,Typographic Poster Design - From Sketch to Vector,https://www.udemy.com/typographic-poster-design-from-sketch-to-vector/,Intermediate Level,1.5,Graphic Design
1745,771044,"Make Money With Photoshop: Logos, Business Cards & Brochures",https://www.udemy.com/make-money-with-photoshop-logos-business-cards-brochures/,All Levels,5.0,Graphic Design
1746,497268,Photoshop the Art of Clipart,https://www.udemy.com/photoshop-the-art-of-clipart/,Beginner Level,1.0,Graphic Design
1747,435138,Adobe Illustrator Creative Cloud:  Mastering the Upgrades,https://www.udemy.com/learn-illustrator-cc-updates/,Intermediate Level,2.0,Graphic Design
1748,334530,Illustrator 101: Learn Quickly and Easily to create Artwork,https://www.udemy.com/make-money-freelancing-after-this-illustrator-course/,All Levels,1.0,Graphic Design
1749,904144,Design Your Own Fonts. Plus A Bunch Of Typography Secrets.,https://www.udemy.com/design-your-own-fonts/,All Levels,1.0,Graphic Design
1750,397946,Easy Steps To Become A Photoshop Expert,https://www.udemy.com/easy-steps-to-become-a-photoshop-expert/,All Levels,8.0,Graphic Design
1751,561800,Intro to Adobe Illustrator,https://www.udemy.com/intro-to-adobe-illustrator/,Beginner Level,6.0,Graphic Design
1752,810234,Beginners Guide: Photoshop Poster/Artwork,https://www.udemy.com/do-it-yourself-learn-photoshop-postersflyers-creation/,Beginner Level,1.0,Graphic Design
1753,559046,Basic Graphic Design for PowerPoint,https://www.udemy.com/basic-graphic-design-for-powerpoint/,Beginner Level,1.0,Graphic Design
1754,338308,Master Graphic Design Using Photoshop with Rachael,https://www.udemy.com/become-a-master-of-photoshop-in-3-hours-guaranteed/,All Levels,1.5,Graphic Design
1755,477634,Adobe Illustrator CC - Print Design for Beginners,https://www.udemy.com/adobe-illustrator-cc-print-design/,Beginner Level,6.0,Graphic Design
1756,913194,Adobe Illustrator | Master in 3D,https://www.udemy.com/adobe-illustrator-master-in-3d/,All Levels,0.5333333333333333,Graphic Design
1757,429866,From Drawing to Illustration,https://www.udemy.com/from-drawing-to-illustration/,Beginner Level,6.0,Graphic Design
1758,632702,Adobe Suite : Unleash your creativity & benefit from it !,https://www.udemy.com/learn-to-animate-design-earn-up-to-100-per-hour/,All Levels,9.5,Graphic Design
1759,429366,Become a Logo Designer: Guide to Complimentary Logo Software,https://www.udemy.com/become-a-logo-designer-guide-to-complimentary-logo-software/,All Levels,2.5,Graphic Design
1760,433084,DIY Beautiful Social Graphics That Don't Require Photoshop,https://www.udemy.com/diy-beautiful-social-graphics-that-dont-require-photoshop/,All Levels,2.5,Graphic Design
1761,185092,Design while you learn InDesign CC,https://www.udemy.com/design-while-you-learn-indesign-cc/,Beginner Level,2.5,Graphic Design
1762,395652,R Graph Essentials,https://www.udemy.com/r-graph-essentials/,All Levels,2.0,Graphic Design
1763,943724,Car Sketching with Simple Analog Tools,https://www.udemy.com/car-sketching-with-markers/,All Levels,0.6166666666666667,Graphic Design
1764,546124,Drawing Anime & Manga Style,https://www.udemy.com/drawing-anime-and-manga-style/,All Levels,8.0,Graphic Design
1765,876444,Inkscape 101 for Beginners - Design Vector Graphics,https://www.udemy.com/inkscape-101-for-beginners-design-vector-graphics/,Beginner Level,1.0,Graphic Design
1766,893978,"How to Fix Common Branding Mistakes, for Graphic Designers",https://www.udemy.com/how-to-fix-common-branding-mistakes-for-graphic-designers/,Intermediate Level,1.5,Graphic Design
1767,1249378,AutoCAD Course - Learn Online AutoCAD in Urdu Hindi,https://www.udemy.com/autocad-course-in-urdu-hindi/,All Levels,2.0,Graphic Design
1768,273256,Mind-Blowing Photoshop: Master Skills Season 1,https://www.udemy.com/mind-blowing-photoshop-master-skills-season-1/,All Levels,3.0,Graphic Design
1769,1240730,Architectural Drawing For Creatives,https://www.udemy.com/architectural-drawing-for-website-and-logo-designers/,All Levels,24.0,Graphic Design
1770,651014,Adobe Photoshop (Complete Beginner),https://www.udemy.com/learn-adobe-photoshop-complete-beginner-to-a-fricken-master/,Beginner Level,2.0,Graphic Design
1771,1236254,Character Design,https://www.udemy.com/character-design/,Intermediate Level,2.0,Graphic Design
1772,1201118,Icon Design Masterclass: Learn Icon Design Principles,https://www.udemy.com/icon-design-masterclass-learn-icon-design-principles/,Beginner Level,2.5,Graphic Design
1773,1227748,create stunning Photoshop compositions in minutes,https://www.udemy.com/create-impressive-photoshop-compositions-in-minutes/,All Levels,2.0,Graphic Design
1774,408118,Marvelous Logo Design,https://www.udemy.com/marvelous-logo-design/,All Levels,1.5,Graphic Design
1775,1258402,Canva Complete Course For Graphics Design | 20 Projects,https://www.udemy.com/canva-course-graphics-design/,All Levels,2.5,Graphic Design
1776,489114,The Complete Video Production Guide - Learn Top Video Tools,https://www.udemy.com/video-production-guide-learn-top-video-tools-to-create-awesome-videos/,All Levels,7.5,Graphic Design
1777,16689,Drawing With Confidence,https://www.udemy.com/drawing-with-confidence/,All Levels,2.0,Graphic Design
1778,1089062,Add realistic car paint to your pencil drawing in Photoshop!,https://www.udemy.com/colorize-your-pencil-drawing-in-photoshop/,Beginner Level,1.0,Graphic Design
1779,709160,T-Shirt Sales - Merch By Amazon Profit Formula With Canva,https://www.udemy.com/merch-by-amazon-quick-start-t-shirt-sales-using-canva-design/,All Levels,1.0,Graphic Design
1780,385662,Learn print production from start to finish,https://www.udemy.com/print-production/,All Levels,1.0,Graphic Design
1781,508570,Step by Step Gif animation in Photoshop,https://www.udemy.com/step-by-step-gif-animation-in-photoshop/,All Levels,1.0,Graphic Design
1782,934790,Adobe - Create a professional logo step-by-step (Farming),https://www.udemy.com/adobe-create-a-professional-logo-step-by-step-farming/,All Levels,1.0,Graphic Design
1783,1133716,Adobe Illustrator CC Advanced,https://www.udemy.com/adobe-illustrator-advanced/,Beginner Level,1.5,Graphic Design
1784,473474,Mastering Realistic Real Life Drawing with Pencil,https://www.udemy.com/mastering-realistic-real-life-drawing-with-pencil/,Beginner Level,0.65,Graphic Design
1785,1143032,Silhouettes that Sells,https://www.udemy.com/silhouettes-that-sells/,Beginner Level,1.0,Graphic Design
1786,121490,FullPage: The Complete Guide to Flat Websites,https://www.udemy.com/easy-flat-design/,All Levels,0.6333333333333333,Graphic Design
1787,339560,How to design professional PowerPoint business presentation,https://www.udemy.com/how-to-design-professional-animated-powerpoint-presentation/,All Levels,1.0,Graphic Design
1788,659340,Pic Monkey for Beginners - Graphic Design and Photo Editing,https://www.udemy.com/pic-monkey-101/,Beginner Level,3.0,Graphic Design
1789,835082,Corel Painter 2016,https://www.udemy.com/corel-painter-2016/,All Levels,8.0,Graphic Design
1790,335902,eBook Cover Design,https://www.udemy.com/ebooks-cover-design/,Intermediate Level,1.5,Graphic Design
1791,441106,"Photoshop tips and tricks, how to change clothes",https://www.udemy.com/changing-clothes-with-photoshop/,All Levels,2.0,Graphic Design
1792,624356,How to make Better Compositions: Take your art to new height,https://www.udemy.com/better-compositions/,All Levels,0.5333333333333333,Graphic Design
1793,456388,Adobe Photoshop CC | The Essential Guide,https://www.udemy.com/adobe-photoshop-cc-the-essential-guide/,All Levels,4.5,Graphic Design
1794,955242,Learn to Composite a 2D Action Shot in Photoshop,https://www.udemy.com/3dmotive-learn-to-composite-a-2d-action-shot-in-photoshop/,Beginner Level,1.5,Graphic Design
1795,496430,Infographic Design: How To Create Your Own Infographic,https://www.udemy.com/infographic-design-how-to-create-your-own-infographic/,All Levels,2.0,Graphic Design
1796,793246,Autodesk Inventor 2016 : Complete Guide ,https://www.udemy.com/learn-autodesk-inventor-2016/,Beginner Level,7.5,Graphic Design
1797,547190,Amazing Graphic Design for Beginners,https://www.udemy.com/amazing-graphic-design-for-beginners/,Beginner Level,0.7,Graphic Design
1798,696630,"7 Ways A Beginner Guitarist Can Sound Better, Instantly!",https://www.udemy.com/nationalguitaracademy/,Beginner Level,0.6,Musical Instruments
1799,643970,Instant Harmonica - Christmas. Play Jingle Bells Part 1 now,https://www.udemy.com/instant-harmonica-christmas-play-jingle-bells-part-1-now/,All Levels,0.7,Musical Instruments
1800,801486,Playing Piano:  Popular Pieces Vol. II,https://www.udemy.com/playing-piano-popular-pieces-volii/,Beginner Level,1.5,Musical Instruments
1801,455054,Ninja Chord Changes - Master your guitar chord changes,https://www.udemy.com/ninja-chord-changes/,Beginner Level,1.5,Musical Instruments
1802,1257976,Your First 10 Guitar Lessons - Learn how to play guitar,https://www.udemy.com/your-first-10-guitar-lessons-learn-how-to-play-guitar/,Beginner Level,1.0,Musical Instruments
1803,1253224,Pentatonic Scale Crash Course for Bass Guitar,https://www.udemy.com/pentatonic-scale-crash-course-for-bass-guitar/,Intermediate Level,1.0,Musical Instruments
1804,837722,Modal Theory for Guitar (Guitar Lessons from Lutz Academy),https://www.udemy.com/modal-theory-for-guitar/,All Levels,1.5,Musical Instruments
1805,631416,Learn Fun Dreamy Piano Techniques #1 -  Play White Christmas,https://www.udemy.com/learn-piano-christmas-song-play-dreamy-piano-music-white-christmas/,All Levels,2.0,Musical Instruments
1806,149728,Learn Jazz Piano Today,https://www.udemy.com/learn-jazz-piano-with-willie-today/,All Levels,3.0,Musical Instruments
1807,195576,Learn To Play The Drums Without A Drum Kit,https://www.udemy.com/learn-to-play-the-drums-without-a-drum-kit/,All Levels,2.0,Musical Instruments
1808,1048302,Learn Travis Picking From Scratch,https://www.udemy.com/learn-travis-picking-from-scratch/,Intermediate Level,1.5,Musical Instruments
1809,560662,Instant Harmonica - how to get single notes in 5 easy steps,https://www.udemy.com/instant-harmonica-how-to-get-single-notes-in-5-easy-steps/,Beginner Level,0.6333333333333333,Musical Instruments
1810,661814,Piano Runs & Fills #3:  Jazzy Chromatic Chord Song Endings,https://www.udemy.com/piano-runs-fills-3-jazz-chromatic-chords-songs-ending/,All Levels,1.0,Musical Instruments
1811,640496,Teaching Music : Start teaching an instrument successfully.,https://www.udemy.com/teaching-piano-a-quick-guide-for-begginers/,Beginner Level,1.5,Musical Instruments
1812,1200374,Strumming from scratch - Rhythm guitar lesson for Beginners,https://www.udemy.com/strumming-from-scratch-rhythm-guitar-lesson-for-beginners/,Beginner Level,2.0,Musical Instruments
1813,101498,Blues Guitar Lessons - From Texas To Carolina,https://www.udemy.com/jim-bruce-blues-guitar-lessons-texas-carolina/,Intermediate Level,2.5,Musical Instruments
1814,729464,Instant Harmonica - play the groovy Beatles Yesterday today!,https://www.udemy.com/instant-harmonica-play-the-groovy-beatles-yesterday-today/,All Levels,1.0,Musical Instruments
1815,961630,Beginner Guitar Quick-Start Course,https://www.udemy.com/learn-guitar-in-30-minutes/,Beginner Level,1.0,Musical Instruments
1816,544234,Mike G's Beginner Drum Course: Part 1,https://www.udemy.com/drumlessons/,Beginner Level,3.0,Musical Instruments
1817,517366,Guitar for Beginners - Learn the Basics,https://www.udemy.com/learnguitar/,Beginner Level,0.5166666666666666,Musical Instruments
1818,271652,How To Play The Djembe: For Beginners,https://www.udemy.com/how-to-play-the-djembe-for-beginners/,All Levels,1.0,Musical Instruments
1819,760066,Blues Guitar Lessons - Volume 1 - Blues Shuffle Essentials,https://www.udemy.com/blues-guitar-magic-volume-1/,All Levels,2.5,Musical Instruments
1820,80844,Beginner Guitar - 38 Easy Lessons You Needs to Get Started,https://www.udemy.com/beginner-guitar-8-lessons-everyone-needs/,Beginner Level,3.0,Musical Instruments
1821,820086,Bass Guitar Lessons For Beginners,https://www.udemy.com/the-music-coach-online-bass-guitar-lesson-program/,Beginner Level,2.5,Musical Instruments
1822,1013558,Pure Pentatonic Power: Rock and Blues Guitar Soloing,https://www.udemy.com/pure-pentatonic-power-a-masterclass-in-rock-and-blues/,All Levels,2.0,Musical Instruments
1823,206332,Rock Drumset Grooves: Level 1,https://www.udemy.com/rock-drumset-grooves-101/,Beginner Level,2.0,Musical Instruments
1824,624662,Guitar: The Next Level,https://www.udemy.com/guitar-the-next-level/,Beginner Level,1.0,Musical Instruments
1825,470472,Learn to Play Euphonium: Beginner to Pro in Under Five Hours,https://www.udemy.com/beginning-euphonium/,Beginner Level,7.0,Musical Instruments
1826,331970,Learn Oud 1 (No Prior Music Knowledge Required!),https://www.udemy.com/learn-oud/,Beginner Level,3.5,Musical Instruments
1827,705890,Instant Harmonica - play Dylan's Blowing in the Wind today!,https://www.udemy.com/instant-harmonica-play-dylans-blowing-in-the-wind-today/,All Levels,1.0,Musical Instruments
1828,932804,Improvise On The Piano In 30 Minutes,https://www.udemy.com/improvise-on-the-piano-in-30-minutes/,Beginner Level,1.5,Musical Instruments
1829,1101522,Cajon Step-by-Step: Beginner > Intermediate > Advanced,https://www.udemy.com/cajon-step-by-step/,All Levels,3.0,Musical Instruments
1830,760300,Blues Guitar Lessons - Volume 2 - Slow Blues Essentials,https://www.udemy.com/blues-guitar-lessons-volume-2-slow-blues-essentials/,All Levels,2.0,Musical Instruments
1831,636858,Instant Harmonica - play the gorgeous Skye Boat Song now!,https://www.udemy.com/instant-harmonica-play-the-gorgeous-skye-boat-song-now/,Beginner Level,0.6333333333333333,Musical Instruments
1832,371896,Learn to Play Trombone: Go From Beginner to Pro in No Time!,https://www.udemy.com/intermediate-trombone/,All Levels,7.5,Musical Instruments
1833,636842,FingerstyleGuitar by Jacques Stotzem - Basic Level,https://www.udemy.com/basic-fingerstyleguitar-jacques-stotzem/,All Levels,1.5,Musical Instruments
1834,564446,Instant Harmonica - play two Star Wars themes in 30 minutes ,https://www.udemy.com/instant-harmonica-play-two-star-wars-themes-in-30-minutes/,Beginner Level,0.7,Musical Instruments
1835,925286,Play Piano To-day! - Beginner Piano Lessons For Busy People!,https://www.udemy.com/piano-for-busy-people/,Beginner Level,4.0,Musical Instruments
1836,324224,Learn to Play the Flute: Beginner to Pro in Under Five Hours,https://www.udemy.com/beginnerflute/,Beginner Level,7.0,Musical Instruments
1837,1008054,Play Piano 7: Improvise on For All We Know in F Key by Ear,https://www.udemy.com/play-piano-7-improvise-on-for-all-we-know-in-f-key-by-ear/,All Levels,1.5,Musical Instruments
1838,40495,World's Fastest Piano Method - The Piano Revolution!,https://www.udemy.com/decplay-the-fastest-way-to-learn-piano/,Beginner Level,2.0,Musical Instruments
1839,184780,Learn to Play the Trumpet: Beginner to Pro Made the Easy Way,https://www.udemy.com/trumpet-a-beginners-guide/,Beginner Level,7.5,Musical Instruments
1840,338926,Learn to Play Clarinet: Beginner to Pro in Under Five Hours,https://www.udemy.com/clarinet-a-beginners-guide/,Beginner Level,6.0,Musical Instruments
1841,104304,"Learn To Play The Piano Using Pop, R&B and Gospel Chords",https://www.udemy.com/learn-to-play-the-piano-using-pop-rb-and-gospel-chords/,All Levels,0.6833333333333333,Musical Instruments
1842,413182,Play By Ear #4: Play Song By Ear with 3 Chords Using Any Key,https://www.udemy.com/play-by-ear-4-play-many-songs-by-ear-with-3-chords-sing/,All Levels,2.5,Musical Instruments
1843,1108666,Worship Piano: From Beginner to Pro,https://www.udemy.com/worship-piano-from-beginner-to-pro/,All Levels,3.0,Musical Instruments
1844,692658,Easy to play Christmas Songs for Guitar,https://www.udemy.com/howtoplaychristmassongsontheguitar/,All Levels,0.5,Musical Instruments
1845,173776,Ultimate Blues Guitar Beginner Lessons,https://www.udemy.com/ultimate-blues-guitar-beginners-course/,Beginner Level,10.5,Musical Instruments
1846,1254852,How to Play Piano - Your First Lesson!,https://www.udemy.com/how-to-play-piano-course/,Beginner Level,0.5166666666666666,Musical Instruments
1847,637842,Playing Piano : Reading and Playing Classical Tunes Vol.I,https://www.udemy.com/piano-playing-beggining-the-journey/,Beginner Level,2.0,Musical Instruments
1848,953442,Blues School! A Course For Beginners in Blues Piano & Improv,https://www.udemy.com/blues-piano-improvisation-amaze-yourself/,All Levels,3.0,Musical Instruments
1849,648628,Learn Fun Dreamy Piano Techniques # 2 - Play Silver Bells,https://www.udemy.com/learn-piano-christmas-song-2-play-dreamy-silver-bells/,All Levels,2.0,Musical Instruments
1850,670640,31 Day Guitar Challenge,https://www.udemy.com/31dayguitar/,Beginner Level,3.5,Musical Instruments
1851,403078,Percussive Fingerstyle Guitar,https://www.udemy.com/percussive-fingerstyle-course/,Intermediate Level,1.5,Musical Instruments
1852,174562,Learn to Play Saxophone: Beginner to Pro in Under Four Hours,https://www.udemy.com/saxophone-a-beginners-guide/,Beginner Level,5.0,Musical Instruments
1853,396238,"Learn BASS GUITAR- Have Fun, Amaze Your Friends- It's Easy! ",https://www.udemy.com/bassguitar/,Beginner Level,2.0,Musical Instruments
1854,20387,Guitar Insanity Workout - Eatmystrings!,https://www.udemy.com/eatmystrings-guitar-insanity-workout/,All Levels,2.5,Musical Instruments
1855,646906,Playing Piano:  Play Chords and Popular Pieces Vol.I,https://www.udemy.com/playing-piano-i-play-chords-and-popular-pieces/,Beginner Level,3.0,Musical Instruments
